title,price,rating,availability,category,title_hashtags,title_mentions,title_keywords
overload how to unplug unwind and unleash yourself from the pressure of stress,52.15,3,14,self help,,,"overload:,how,unplug,,unwind,,and"
once was a time,18.28,2,14,childrens,,,"once,was,time"
old school diary of a wimpy kid 10,11.83,5,14,humor,#10,,"old,school,(diary,wimpy,kid"
no dream is too high life lessons from a man who walked on the moon,21.95,2,14,nonfiction,,,"dream,too,high:,life,lessons"
naruto 3in1 edition vol 14 includes vols 40 41 42 naruto omnibus 14,38.39,2,14,sequential art,#14,,"naruto,(3-in-1,edition),,vol.,14:"
my name is lucy barton,41.56,1,14,fiction,,,"name,lucy,barton"
my mrs brown,24.48,3,14,fiction,,,"mrs.,brown"
my kind of crazy,40.36,1,14,young adult,,,"kind,crazy"
mr mercedes bill hodges trilogy 1,28.9,1,14,fiction,#1,,"mr.,mercedes,(bill,hodges,trilogy"
more than music chasing the dream 1,37.61,2,14,add a comment,#1,,"more,than,music,(chasing,the"
made to stick why some ideas survive and others die,38.85,5,14,business,,,"made,stick:,why,some,ideas"
luis paints the world,53.95,3,14,childrens,,,"luis,paints,the,world"
luckiest girl alive,49.83,3,14,default,,,"luckiest,girl,alive"
lowriders to the center of the earth lowriders in space 2,51.51,2,14,sequential art,#2,,"lowriders,the,center,the,earth"
love is a mix tape music 1,18.03,1,14,music,#1,,"love,mix,tape,(music,#1)"
looking for lovely collecting the moments that matter,29.14,5,14,nonfiction,,,"looking,for,lovely:,collecting,the"
living leadership by insight a good leader achieves a great leader builds monuments,46.91,4,14,default,,,"living,leadership,insight:,good,leader"
let it out a journey through journaling,26.79,5,14,nonfiction,,,"let,out:,journey,through,journaling"
lady midnight the dark artifices 1,16.28,5,14,default,#1,,"lady,midnight,(the,dark,artifices"
its all easy healthy delicious weeknight meals in under 30 minutes,19.55,1,14,food and drink,,,"it's,all,easy:,healthy,,delicious"
island of dragons unwanteds 7,29.65,1,14,fantasy,#7,,"island,dragons,(unwanteds,#7)"
i know what im doing and other lies i tell myself dispatches from a life under construction,25.98,4,14,humor,,,"know,what,i'm,doing,and"
i am pilgrim pilgrim 1,10.6,4,14,fiction,#1,,"pilgrim,(pilgrim,#1)"
hyperbole and a half unfortunate situations flawed coping mechanisms mayhem and other things that happened,14.75,5,14,humor,,,"hyperbole,and,half:,unfortunate,situations,"
hush hush hush hush 1,47.02,3,14,default,#1,,"hush,,hush,(hush,,hush,#1)"
hold your breath search and rescue 1,28.82,1,14,romance,#1,,"hold,your,breath,(search,and"
hamilton the revolution,58.79,3,14,nonfiction,,,"hamilton:,the,revolution"
greek mythic history,10.23,5,14,default,,,"greek,mythic,history"
god the most unpleasant character in all fiction,30.03,5,14,religion,,,"god:,the,most,unpleasant,character"
glory over everything beyond the kitchen house,45.84,3,14,historical fiction,,,"glory,over,everything:,beyond,the"
feathers displays of brilliant plumage,49.05,3,14,art,,,"feathers:,displays,brilliant,plumage"
far away places on the brink of change seven continents twentyfive years,15.06,4,14,nonfiction,,,"far,away:,places,the,brink"
every last word,46.47,3,14,default,,,"every,last,word"
eligible the austen project 4,27.09,3,14,fiction,#4,,"eligible,(the,austen,project,#4)"
el deafo,57.62,5,14,sequential art,,,deafo
eight hundred grapes,14.39,4,14,fiction,,,"eight,hundred,grapes"
eaternity more than 150 deliciously easy vegan recipes for a long healthy satisfied joyful life,51.75,5,14,nonfiction,,,"eaternity:,more,than,150,deliciously"
eat fat get thin,54.07,2,14,health,,,"eat,fat,,get,thin"
dont get caught,55.35,1,14,young adult,,,"don't,get,caught"
doctor sleep the shining 2,40.12,2,14,horror,#2,,"doctor,sleep,(the,shining,#2)"
demigods magicians percy and annabeth meet the kanes percy jackson kane chronicles crossover 13,37.51,5,14,fantasy,#1,,"demigods,magicians:,percy,and,annabeth"
dear mr knightley,11.21,5,14,fiction,,,"dear,mr.,knightley"
daily fantasy sports,36.58,1,14,default,,,"daily,fantasy,sports"
crazy love overwhelmed by a relentless god,47.72,2,14,christian,,,"crazy,love:,overwhelmed,relentless,god"
cometh the hour the clifton chronicles 6,25.01,3,14,fiction,#6,,"cometh,the,hour,(the,clifton"
code name verity code name verity 1,22.13,4,14,add a comment,#1,,"code,name,verity,(code,name"
clockwork angel the infernal devices 1,44.14,1,14,default,#1,,"clockwork,angel,(the,infernal,devices"
city of glass the mortal instruments 3,56.02,4,14,fantasy,#3,,"city,glass,(the,mortal,instruments"
city of fallen angels the mortal instruments 4,11.23,4,14,default,#4,,"city,fallen,angels,(the,mortal"
city of bones the mortal instruments 1,43.28,1,14,default,#1,,"city,bones,(the,mortal,instruments"
city of ashes the mortal instruments 2,47.27,1,14,default,#2,,"city,ashes,(the,mortal,instruments"
cell,20.29,4,14,add a comment,,,cell
catching jordan hundred oaks,50.83,3,14,young adult,,,"catching,jordan,(hundred,oaks)"
carry on warrior thoughts on life unarmed,31.85,3,14,default,,,"carry,on,,warrior:,thoughts,life"
carrie,46.23,2,14,default,,,carrie
buying in the secret dialogue between what we buy and who we are,37.8,4,14,nonfiction,,,"buying,in:,the,secret,dialogue"
brain on fire my month of madness,49.32,5,14,nonfiction,,,"brain,fire:,month,madness"
batman europa,32.01,2,14,sequential art,,,"batman:,europa"
barefoot contessa back to basics,28.01,1,14,food and drink,,,"barefoot,contessa,back,basics"
barefoot contessa at home everyday recipes youll make over and over again,50.62,5,14,food and drink,,,"barefoot,contessa,home:,everyday,recipes"
balloon animals,17.03,3,14,fiction,,,"balloon,animals"
art ops vol 1,48.8,3,14,sequential art,,,"art,ops,vol."
aristotle and dante discover the secrets of the universe aristotle and dante discover the secrets of the universe 1,58.14,4,14,young adult,#1,,"aristotle,and,dante,discover,the"
angels walking angels walking 1,34.2,2,14,add a comment,#1,,"angels,walking,(angels,walking,#1)"
angels demons robert langdon 1,51.48,3,14,default,#1,,"angels,demons,(robert,langdon,#1)"
all the light we cannot see,29.87,5,14,historical,,,"all,the,light,cannot,see"
adulthood is a myth a sarahs scribbles collection,10.9,2,14,sequential art,,,"adulthood,myth:,""sarah's,scribbles"",collection"
abstract city,56.37,5,14,nonfiction,,,"abstract,city"
a time of torment charlie parker 14,48.35,5,14,mystery,#14,,"time,torment,(charlie,parker,#14)"
a study in scarlet sherlock holmes 1,16.73,2,14,mystery,#1,,"study,scarlet,(sherlock,holmes,#1)"
a series of catastrophes and miracles a true story of love science and cancer,56.48,2,14,add a comment,,,"series,catastrophes,and,miracles:,true"
a peoples history of the united states,40.79,2,14,add a comment,,,"people's,history,the,united,states"
a man called ove,39.72,1,14,fiction,,,"man,called,ove"
a distant mirror the calamitous 14th century,14.58,3,14,history,,,"distant,mirror:,the,calamitous,14th"
a brush of wings angels walking 3,55.51,1,14,add a comment,#3,,"brush,wings,(angels,walking,#3)"
1491 new revelations of the americas before columbus,21.8,3,14,history,,,"1491:,new,revelations,the,americas"
the three searches meaning and the story,13.33,3,13,default,,,"the,three,searches,,meaning,,and"
searching for meaning in gailana,38.73,1,13,fantasy,,,"searching,for,meaning,gailana"
rook,37.86,4,13,add a comment,,,rook
my kitchen year 136 recipes that saved my life,11.53,2,13,food and drink,,,"kitchen,year:,136,recipes,that"
13 hours the inside account of what really happened in benghazi,27.06,1,13,nonfiction,,,"hours:,the,inside,account,what"
will you wont you want me,13.86,3,12,womens fiction,,,"will,you,won't,you,want"
tipping point for planet earth how close are we to the edge,37.55,1,12,science,,,"tipping,point,for,planet,earth:"
the silent sister riley macpherson 1,46.29,5,12,fiction,#1,,"the,silent,sister,(riley,macpherson"
the midnight watch a novel of the titanic and the californian,26.2,1,12,add a comment,,,"the,midnight,watch:,novel,the"
the lonely city adventures in the art of being alone,33.26,2,12,nonfiction,,,"the,lonely,city:,adventures,the"
the gray rhino how to recognize and act on the obvious dangers we ignore,59.15,4,12,add a comment,,,"the,gray,rhino:,how,recognize"
the golden condom and other essays on love lost and found,39.43,1,12,psychology,,,"the,golden,condom:,and,other"
the epidemic the program 06,14.44,5,12,young adult,,,"the,epidemic,(the,program,0.6)"
the dinner party,56.54,2,12,fiction,,,"the,dinner,party"
the diary of a young girl,59.9,3,12,nonfiction,,,"the,diary,young,girl"
the children,11.88,3,12,add a comment,,,"the,children"
stars above the lunar chronicles 45,48.05,2,12,young adult,#4,,"stars,above,(the,lunar,chronicles"
snatched how a drug queen went undercover for the dea and was kidnapped by colombian guerillas,21.21,3,12,nonfiction,,,"snatched:,how,drug,queen,went"
raspberry pi electronics projects for the evil genius,49.67,4,12,default,,,"raspberry,electronics,projects,for,the"
quench your own thirst business lessons learned over a beer or two,43.14,1,12,business,,,"quench,your,own,thirst:,business"
psycho sanitarium psycho 15,36.97,5,12,horror,#1,,"psycho:,sanitarium,(psycho,#1.5)"
poisonous max revere novels 3,26.8,3,12,mystery,#3,,"poisonous,(max,revere,novels,#3)"
one with you crossfire 5,15.71,4,12,add a comment,#5,,"one,with,you,(crossfire,#5)"
no love allowed dodge cove 1,54.65,4,12,young adult,#1,,"love,allowed,(dodge,cove,#1)"
murder at the 42nd street library raymond ambler 1,54.36,4,12,mystery,#1,,"murder,the,42nd,street,library"
most wanted,35.28,3,12,mystery,,,"most,wanted"
love lies and spies,20.55,2,12,historical fiction,,,"love,,lies,and,spies"
how to speak golf an illustrated guide to links lingo,58.32,5,12,default,,,"how,speak,golf:,illustrated,guide"
hide away eve duncan 20,11.84,1,12,mystery,#20,,"hide,away,(eve,duncan,#20)"
furiously happy a funny book about horrible things,41.46,4,12,nonfiction,,,"furiously,happy:,funny,book,about"
everyday italian 125 simple and delicious recipes,20.1,5,12,food and drink,,,"everyday,italian:,125,simple,and"
equal is unfair americas misguided fight against income inequality,56.86,1,12,politics,,,"equal,unfair:,america's,misguided,fight"
eleanor park,56.51,5,12,default,,,"eleanor,park"
dirty dive bar 1,40.83,4,12,romance,#1,,"dirty,(dive,bar,#1)"
can you keep a secret fear street relaunch 4,48.64,1,12,horror,#4,,"can,you,keep,secret?,(fear"
boar island anna pigeon 19,59.48,3,12,mystery,#19,,"boar,island,(anna,pigeon,#19)"
a paris apartment,39.01,4,12,historical fiction,,,"paris,apartment"
a la mode 120 recipes in 60 pairings pies tarts cakes crisps and more topped with ice cream gelato frozen custard and more,38.77,1,12,food and drink,,,"mode:,120,recipes,pairings:,pies,"
troublemaker surviving hollywood and scientology,48.39,2,11,default,,,"troublemaker:,surviving,hollywood,and,scientology"
the widow,27.26,2,11,mystery,,,"the,widow"
the sleep revolution transforming your life one night at a time,11.68,4,11,nonfiction,,,"the,sleep,revolution:,transforming,your"
the improbability of love,59.45,1,11,fiction,,,"the,improbability,love"
the art of startup fundraising,21.0,3,11,business,,,"the,art,startup,fundraising"
take me home tonight rock star romance 3,53.98,3,11,romance,#3,,"take,home,tonight,(rock,star"
sleeping giants themis files 1,48.74,1,11,science fiction,#1,,"sleeping,giants,(themis,files,#1)"
setting the world on fire the brief astonishing life of st catherine of siena,21.15,2,11,biography,,,"setting,the,world,fire:,the"
playing with fire,13.71,3,11,mystery,,,"playing,with,fire"
off the hook fishing for trouble 1,47.67,3,11,romance,#1,,"off,the,hook,(fishing,for"
mothering sunday,13.34,2,11,fiction,,,"mothering,sunday"
mother can you not,16.89,5,11,nonfiction,,,"mother,,can,you,not?"
m train,27.18,1,11,autobiography,,,train
lilac girls,17.28,2,11,historical fiction,,,"lilac,girls"
lies and other acts of love,45.14,1,11,fiction,,,"lies,and,other,acts,love"
lab girl,40.85,1,11,autobiography,,,"lab,girl"
keep me posted,20.46,4,11,womens fiction,,,"keep,posted"
it didnt start with you how inherited family trauma shapes who we are and how to end the cycle,56.27,3,11,psychology,,,"didn't,start,with,you:,how"
grey fifty shades 4,48.49,4,11,womens fiction,#4,,"grey,(fifty,shades,#4)"
exit pursued by a bear,51.34,4,11,young adult,,,"exit,,pursued,bear"
daredevils,16.34,3,11,fiction,,,daredevils
cravings recipes for what you want to eat,20.5,3,11,food and drink,,,"cravings:,recipes,for,what,you"
born for this how to find the work you were meant to do,21.59,5,11,business,,,"born,for,this:,how,find"
arena,21.36,4,11,science fiction,,,arena
adultery,20.88,5,11,default,,,adultery
a mothers reckoning living in the aftermath of tragedy,19.53,3,11,nonfiction,,,"mother's,reckoning:,living,the,aftermath"
a gentlemans position society of gentlemen 3,14.75,5,11,romance,#3,,"gentleman's,position,(society,gentlemen,#3)"
112263,48.48,3,11,fiction,,,11/22/63
10 happier how i tamed the voice in my head reduced stress without losing my edge and found selfhelp that actually works,24.57,2,10,nonfiction,,,"10%,happier:,how,tamed,the"
10day green smoothie cleanse lose up to 15 pounds in 10 days,49.71,5,10,health,,,"10-day,green,smoothie,cleanse:,lose"
without shame,48.27,5,9,add a comment,,,"without,shame"
watchmen,58.05,4,9,add a comment,,,watchmen
unlimited intuition now,58.87,4,9,default,,,"unlimited,intuition,now"
underlying notes,11.82,2,9,default,,,"underlying,notes"
the shack,28.03,1,9,fiction,,,"the,shack"
the new brand you your new image makes the sale for you,44.05,5,9,default,,,"the,new,brand,you:,your"
the moosewood cookbook recipes from moosewood restaurant ithaca new york,12.34,4,9,food and drink,,,"the,moosewood,cookbook:,recipes,from"
the flowers lied,16.68,2,9,default,,,"the,flowers,lied"
the fabric of the cosmos space time and the texture of reality,55.91,1,9,science,,,"the,fabric,the,cosmos:,space,"
the book of mormon,24.57,3,9,religion,,,"the,book,mormon"
the art and science of low carbohydrate living,52.98,5,9,health,,,"the,art,and,science,low"
the alien club,54.4,1,9,young adult,,,"the,alien,club"
suzie snowflake one beautiful flake a selfesteem story,54.81,5,9,novels,,,"suzie,snowflake:,one,beautiful,flake"
naparoo,25.08,1,9,childrens,,,nap-a-roo
nano what now finding your editing process revising your nanowrimo book and building a writing career through publishing and beyond,10.41,4,9,default,,,"nano,what,now?,finding,your"
modern day fables,47.44,2,9,default,,,"modern,day,fables"
if i gave you gods phone number searching for spirituality in america,20.91,1,9,spirituality,,,"gave,you,god's,phone,number....:"
fruits basket vol 9 fruits basket 9,33.95,4,9,sequential art,#9,,"fruits,basket,,vol.,(fruits,basket"
dress your family in corduroy and denim,43.68,3,9,humor,,,"dress,your,family,corduroy,and"
dont forget steven,33.23,1,9,young adult,,,"don't,forget,steven"
chernobyl 012340 the incredible true story of the worlds worst nuclear disaster,35.92,2,9,nonfiction,,,"chernobyl,01:23:40:,the,incredible,true"
art and fear observations on the perils and rewards of artmaking,48.63,4,9,art,,,"art,and,fear:,observations,the"
a shard of ice the black symphony saga 1,56.63,3,9,fantasy,#1,,"shard,ice,(the,black,symphony"
a heros curse the unseen chronicles 1,50.49,3,9,add a comment,#1,,"hero's,curse,(the,unseen,chronicles"
23 degrees south a tropical tale of changing whether,35.79,2,9,add a comment,,,"degrees,south:,tropical,tale,changing"
zero to one notes on startups or how to build the future,34.06,3,8,nonfiction,,,"zero,one:,notes,startups,,how"
why not me,17.76,1,8,nonfiction,,,"why,not,me?"
when breath becomes air,39.36,2,8,nonfiction,,,"when,breath,becomes,air"
vagabonding an uncommon guide to the art of longterm world travel,36.94,2,8,travel,,,"vagabonding:,uncommon,guide,the,art"
the unlikely pilgrimage of harold fry harold fry 1,43.62,5,8,default,#1,,"the,unlikely,pilgrimage,harold,fry"
the new drawing on the right side of the brain,43.02,3,8,art,,,"the,new,drawing,the,right"
the midnight assassin panic scandal and the hunt for americas first serial killer,28.45,4,8,nonfiction,,,"the,midnight,assassin:,panic,,scandal,"
the martian the martian 1,41.39,2,8,default,#1,,"the,martian,(the,martian,#1)"
the high mountains of portugal,51.15,1,8,fiction,,,"the,high,mountains,portugal"
the grownup,35.88,1,8,short stories,,,"the,grownup"
the emyth revisited why most small businesses dont work and what to do about it,36.91,1,8,business,,,"the,e-myth,revisited:,why,most"
south of sunshine,28.93,1,8,young adult,,,"south,sunshine"
smarter faster better the secrets of being productive in life and business,38.89,5,8,nonfiction,,,"smarter,faster,better:,the,secrets"
silence in the dark logan point 4,58.33,3,8,suspense,#4,,"silence,the,dark,(logan,point"
shadows of the past logan point 1,39.67,5,8,christian fiction,#1,,"shadows,the,past,(logan,point"
roller girl,14.1,5,8,sequential art,,,"roller,girl"
rising strong,21.82,3,8,nonfiction,,,"rising,strong"
proofs of god classical arguments from tertullian to barth,54.21,1,8,philosophy,,,"proofs,god:,classical,arguments,from"
please kill me the uncensored oral history of punk,31.19,4,8,music,,,"please,kill,me:,the,uncensored"
out of print city lights spotlight no 14,53.64,5,8,poetry,,,"out,print:,city,lights,spotlight"
my life next door my life next door ,36.39,5,8,young adult,,,"life,next,door,(my,life"
millers valley,58.54,2,8,fiction,,,"miller's,valley"
mans search for meaning,29.48,3,8,nonfiction,,,"man's,search,for,meaning"
love that boy what two presidents eight road trips and my son taught me about a parents expectations,25.06,2,8,nonfiction,,,"love,that,boy:,what,two"
living forward a proven plan to stop drifting and get the life you want,12.55,3,8,nonfiction,,,"living,forward:,proven,plan,stop"
les fleurs du mal,29.04,5,8,poetry,,,"les,fleurs,mal"
left behind left behind 1,40.72,2,8,default,#1,,"left,behind,(left,behind,#1)"
kill em and leave searching for james brown and the american soul,45.05,5,8,music,,,"kill,'em,and,leave:,searching"
kierkegaard a christian missionary to christians,47.13,1,8,philosophy,,,"kierkegaard:,christian,missionary,christians"
john vassos industrial design for modern life,20.22,4,8,default,,,"john,vassos:,industrial,design,for"
ill give you the sun,56.48,1,8,default,,,"i'll,give,you,the,sun"
i will find you,44.21,1,8,nonfiction,,,"will,find,you"
hystopia a novel,21.96,4,8,fiction,,,"hystopia:,novel"
howl and other poems,40.45,2,8,poetry,,,"howl,and,other,poems"
history of beauty,10.29,4,8,art,,,"history,beauty"
heaven is for real a little boys astounding story of his trip to heaven and back,52.86,2,8,default,,,"heaven,for,real:,little,boy's"
future shock future shock 1,55.65,5,8,young adult,#1,,"future,shock,(future,shock,#1)"
enders game the ender quintet 1,43.64,1,8,default,#1,,"ender's,game,(the,ender,quintet"
diary of a citizen scientist chasing tiger beetles and other new ways of engaging the world,28.41,1,8,science,,,"diary,citizen,scientist:,chasing,tiger"
death by leisure a cautionary tale,37.51,4,8,default,,,"death,leisure:,cautionary,tale"
brilliant beacons a history of the american lighthouse,11.45,3,8,history,,,"brilliant,beacons:,history,the,american"
brazen the courage to find the you thats been hiding,19.22,2,8,nonfiction,,,"brazen:,the,courage,find,the"
between the world and me,56.91,4,8,nonfiction,,,"between,the,world,and"
being mortal medicine and what matters in the end,55.06,4,8,nonfiction,,,"being,mortal:,medicine,and,what"
a murder over a girl justice gender junior high,13.2,3,8,nonfiction,,,"murder,over,girl:,justice,,gender,"
32 yolks,53.63,2,8,food and drink,,,yolks
most blessed of the patriarchs thomas jefferson and the empire of the imagination,44.48,5,8,history,,,"""most,blessed,the,patriarchs"":,thomas"
you are a badass how to stop doubting your greatness and start living an awesome life,12.08,3,7,self help,,,"you,are,badass:,how,stop"
wildlife of new york a fiveborough coloring book,22.14,2,7,default,,,"wildlife,new,york:,five-borough,coloring"
what happened on beale street secrets of the south mysteries 2,25.37,5,7,mystery,#2,,"what,happened,beale,street,(secrets"
unreasonable hope finding faith in the god who brings purpose to your pain,46.33,2,7,spirituality,,,"unreasonable,hope:,finding,faith,the"
under the tuscan sun,37.33,3,7,travel,,,"under,the,tuscan,sun"
toddlers are aholes its not your fault,25.55,1,7,humor,,,"toddlers,are,a**holes:,it's,not"
the year of living biblically one mans humble quest to follow the bible as literally as possible,34.72,1,7,default,,,"the,year,living,biblically:,one"
the whale,35.96,4,7,childrens,,,"the,whale"
the story of art,41.14,4,7,art,,,"the,story,art"
the origin of species,10.01,4,7,science,,,"the,origin,species"
the great gatsby,36.05,4,7,default,,,"the,great,gatsby"
the good girl,49.03,3,7,default,,,"the,good,girl"
the glass castle,16.24,1,7,add a comment,,,"the,glass,castle"
the faith of christopher hitchens the restless soul of the worlds most notorious atheist,39.55,1,7,biography,,,"the,faith,christopher,hitchens:,the"
the drowning girls,35.67,3,7,add a comment,,,"the,drowning,girls"
the constant princess the tudor court 1,16.62,3,7,historical fiction,#1,,"the,constant,princess,(the,tudor"
the bourne identity jason bourne 1,42.78,4,7,fiction,#1,,"the,bourne,identity,(jason,bourne"
the bachelor girls guide to murder herringford and watts mysteries 1,52.3,5,7,mystery,#1,,"the,bachelor,girl's,guide,murder"
the art book,32.34,2,7,art,,,"the,art,book"
the 7 habits of highly effective people powerful lessons in personal change,33.17,4,7,default,,,"the,habits,highly,effective,people:"
team of rivals the political genius of abraham lincoln,20.12,5,7,add a comment,,,"team,rivals:,the,political,genius"
steal like an artist 10 things nobody told you about being creative,20.9,2,7,default,,,"steal,like,artist:,things,nobody"
sit stay love,20.9,3,7,romance,,,"sit,,stay,,love"
sister dear,40.2,4,7,fiction,,,"sister,dear"
shrunken treasures literary classics short sweet and silly,52.87,3,7,childrens,,,"shrunken,treasures:,literary,classics,,short,"
rich dad poor dad,51.74,1,7,business,,,"rich,dad,,poor,dad"
raymie nightingale,34.41,2,7,childrens,,,"raymie,nightingale"
playing from the heart,32.38,1,7,childrens,,,"playing,from,the,heart"
nightstruck a novel,50.35,4,7,young adult,,,"nightstruck:,novel"
naturally lean 125 nourishing glutenfree plantbased recipesall under 300 calories,11.38,5,7,food and drink,,,"naturally,lean:,125,nourishing,gluten-free,"
meternity,43.58,3,7,womens fiction,,,meternity
memoirs of a geisha,49.67,3,7,fiction,,,"memoirs,geisha"
like never before walker family 2,28.77,2,7,christian fiction,#2,,"like,never,before,(walker,family"
life of pi,13.22,4,7,default,,,life
leave this song behind teen poetry at its best,51.17,5,7,poetry,,,"leave,this,song,behind:,teen"
kings folly the kinsman chronicles 1,39.61,5,7,fantasy,#1,,"king's,folly,(the,kinsman,chronicles"
john adams,57.43,4,7,add a comment,,,"john,adams"
how to cook everything vegetarian simple meatless recipes for great food how to cook everything,46.01,4,7,food and drink,,,"how,cook,everything,vegetarian:,simple"
how to be a domestic goddess baking and the art of comfort cooking,28.25,2,7,food and drink,,,"how,domestic,goddess:,baking,and"
good in bed cannie shapiro 1,37.05,5,7,add a comment,#1,,"good,bed,(cannie,shapiro,#1)"
fruits basket vol 7 fruits basket 7,19.57,1,7,sequential art,#7,,"fruits,basket,,vol.,(fruits,basket"
for the love fighting for grace in a world of impossible standards,45.13,3,7,nonfiction,,,"for,the,love:,fighting,for"
finding god in the ruins how god redeems pain,46.64,2,7,nonfiction,,,"finding,god,the,ruins:,how"
every heart a doorway every heart a doorway 1,12.16,5,7,fantasy,#1,,"every,heart,doorway,(every,heart"
delivering the truth quaker midwife mystery 1,20.89,4,7,mystery,#1,,"delivering,the,truth,(quaker,midwife"
counted with the stars out from egypt 1,17.97,5,7,christian fiction,#1,,"counted,with,the,stars,(out"
chronicles vol 1,52.6,2,7,music,,,"chronicles,,vol."
blue like jazz nonreligious thoughts on christian spirituality,25.77,1,7,christian,,,"blue,like,jazz:,nonreligious,thoughts"
benjamin franklin an american life,48.19,3,7,biography,,,"benjamin,franklin:,american,life"
at the existentialist caf freedom being and apricot cocktails with jeanpaul sartre simone de beauvoir albert camus martin heidegger edmund husserl karl jaspers maurice merleauponty and others,29.93,5,7,philosophy,,,"the,existentialist,café:,freedom,,being,"
a summer in europe,44.34,2,7,travel,,,"summer,europe"
a short history of nearly everything,52.4,5,7,history,,,"short,history,nearly,everything"
a gathering of shadows shades of magic 2,44.81,4,7,fantasy,#2,,"gathering,shadows,(shades,magic,#2)"
the sound of love,57.84,5,6,default,,,"the,sound,love"
the rise and fall of the third reich a history of nazi germany,39.67,2,6,history,,,"the,rise,and,fall,the"
the perks of being a wallflower,55.02,3,6,default,,,"the,perks,being,wallflower"
the mysterious affair at styles hercule poirot 1,24.8,4,6,mystery,#1,,"the,mysterious,affair,styles,(hercule"
the man who mistook his wife for a hat and other clinical tales,59.45,4,6,nonfiction,,,"the,man,who,mistook,his"
the makings of a fatherless child,31.58,2,6,default,,,"the,makings,fatherless,child"
the joy of cooking,43.27,4,6,add a comment,,,"the,joy,cooking"
the invention of wings,37.34,1,6,historical fiction,,,"the,invention,wings"
the hobbit middleearth universe,17.8,5,6,default,,,"the,hobbit,(middle-earth,universe)"
the great railway bazaar,30.54,1,6,travel,,,"the,great,railway,bazaar"
the golden compass his dark materials 1,18.77,1,6,add a comment,#1,,"the,golden,compass,(his,dark"
the god delusion,46.85,3,6,add a comment,,,"the,god,delusion"
