title,price,rating,availability,category,title_hashtags,title_mentions,title_keywords
the girl you left behind the girl you left behind 1,15.79,1,6,historical,#1,,"the,girl,you,left,behind"
the fellowship of the ring the lord of the rings 1,10.27,2,6,default,#1,,"the,fellowship,the,ring,(the"
the collected poems of wb yeats the collected works of wb yeats 1,15.42,5,6,poetry,#1,,"the,collected,poems,w.b.,yeats"
the barefoot contessa cookbook,59.92,5,6,food and drink,,,"the,barefoot,contessa,cookbook"
tell the wolves im home,50.96,2,6,young adult,,,"tell,the,wolves,i'm,home"
ship leaves harbor essays on travel by a recovering journeyman,30.6,3,6,default,,,"ship,leaves,harbor:,essays,travel"
pride and prejudice,19.27,4,6,add a comment,,,"pride,and,prejudice"
musicophilia tales of music and the brain,46.58,1,6,default,,,"musicophilia:,tales,music,and,the"
mere christianity,48.51,3,6,add a comment,,,"mere,christianity"
me before you me before you 1,19.02,1,6,fiction,#1,,"before,you,(me,before,you"
in the woods dublin murder squad 1,38.38,2,6,mystery,#1,,"the,woods,(dublin,murder,squad"
in cold blood,49.98,4,6,nonfiction,,,"cold,blood"
how to stop worrying and start living,46.49,5,6,self help,,,"how,stop,worrying,and,start"
give it back,18.32,2,6,thriller,,,"give,back"
girl interrupted,42.14,3,6,nonfiction,,,"girl,,interrupted"
fun home a family tragicomic,56.59,4,6,add a comment,,,"fun,home:,family,tragicomic"
fruits basket vol 6 fruits basket 6,20.96,4,6,sequential art,#6,,"fruits,basket,,vol.,(fruits,basket"
deception point,40.32,4,6,fiction,,,"deception,point"
death note vol 6 giveandtake death note 6,36.39,3,6,sequential art,#6,,"death,note,,vol.,give-and-take,(death"
catherine the great portrait of a woman,58.55,4,6,history,,,"catherine,the,great:,portrait,woman"
better homes and gardens new cook book,39.61,3,6,food and drink,,,"better,homes,and,gardens,new"
an unquiet mind a memoir of moods and madness,21.3,3,6,psychology,,,"unquiet,mind:,memoir,moods,and"
a year in provence provence 1,56.88,4,6,travel,#1,,"year,provence,(provence,#1)"
world without end the pillars of the earth 2,32.97,4,5,historical fiction,#2,,"world,without,end,(the,pillars"
will grayson will grayson will grayson will grayson,47.31,4,5,young adult,,,"will,grayson,,will,grayson,(will"
why save the bankers and other essays on our economic and political crisis,48.67,2,5,nonfiction,,,"why,save,the,bankers?:,and"
where she went if i stay 2,41.73,4,5,young adult,#2,,"where,she,went,(if,stay"
what if serious scientific answers to absurd hypothetical questions,53.68,4,5,default,,,"what,if?:,serious,scientific,answers"
two summers,14.64,1,5,young adult,,,"two,summers"
this is your brain on music the science of a human obsession,38.4,1,5,music,,,"this,your,brain,music:,the"
the secret garden,15.08,4,5,classics,,,"the,secret,garden"
the raven king the raven cycle 4,30.57,2,5,add a comment,#4,,"the,raven,king,(the,raven"
the raven boys the raven cycle 1,57.74,4,5,fantasy,#1,,"the,raven,boys,(the,raven"
the power greens cookbook 140 delicious superfood recipes,11.05,5,5,food and drink,,,"the,power,greens,cookbook:,140"
the metamorphosis,28.58,1,5,classics,,,"the,metamorphosis"
the mathews men seven brothers and the war against hitlers uboats,42.91,5,5,history,,,"the,mathews,men:,seven,brothers"
the little paris bookshop,24.73,3,5,fiction,,,"the,little,paris,bookshop"
the hiding place,55.91,4,5,history,,,"the,hiding,place"
the grand design,13.76,3,5,science,,,"the,grand,design"
the firm,45.56,3,5,fiction,,,"the,firm"
the fault in our stars,47.22,1,5,default,,,"the,fault,our,stars"
the false prince the ascendance trilogy 1,56.0,5,5,fantasy,#1,,"the,false,prince,(the,ascendance"
the expatriates,44.58,2,5,fiction,,,"the,expatriates"
the dream thieves the raven cycle 2,34.5,1,5,default,#2,,"the,dream,thieves,(the,raven"
the darkest corners,11.33,5,5,young adult,,,"the,darkest,corners"
the crossover,38.77,4,5,poetry,,,"the,crossover"
the 5th wave the 5th wave 1,11.83,2,5,default,#1,,"the,5th,wave,(the,5th"
tell the wind and fire,45.51,3,5,fantasy,,,"tell,the,wind,and,fire"
tell me three things,41.81,1,5,young adult,,,"tell,three,things"
talking to girls about duran duran one young mans quest for true love and a cooler haircut,25.15,4,5,nonfiction,,,"talking,girls,about,duran,duran:"
siddhartha,34.22,5,5,fiction,,,siddhartha
shiver the wolves of mercy falls 1,16.23,5,5,default,#1,,"shiver,(the,wolves,mercy,falls"
remember me,11.48,3,5,default,,,"remember,me?"
red dragon hannibal lecter 1,23.37,3,5,horror,#1,,"red,dragon,(hannibal,lecter,#1)"
peak secrets from the new science of expertise,16.28,2,5,science,,,"peak:,secrets,from,the,new"
my mother was nuts,31.63,4,5,nonfiction,,,"mother,was,nuts"
mexican today new and rediscovered recipes for contemporary kitchens,24.91,5,5,food and drink,,,"mexican,today:,new,and,rediscovered"
maybe something beautiful how art transformed a neighborhood,22.54,1,5,childrens,,,"maybe,something,beautiful:,how,art"
lola and the boy next door anna and the french kiss 2,23.63,4,5,young adult,#2,,"lola,and,the,boy,next"
logan kade fallen crest high 55,13.12,2,5,academic,#5,,"logan,kade,(fallen,crest,high"
last one home new beginnings 1,59.98,3,5,fiction,#1,,"last,one,home,(new,beginnings"
killing floor jack reacher 1,31.49,4,5,thriller,#1,,"killing,floor,(jack,reacher,#1)"
kill the boy band,15.52,5,5,young adult,,,"kill,the,boy,band"
isla and the happily ever after anna and the french kiss 3,48.13,5,5,young adult,#3,,"isla,and,the,happily,ever"
if i stay if i stay 1,38.13,5,5,default,#1,,"stay,(if,stay,#1)"
i know why the caged bird sings maya angelous autobiography 1,36.55,2,5,default,#1,,"know,why,the,caged,bird"
harry potter and the deathly hallows harry potter 7,23.32,1,5,default,#7,,"harry,potter,and,the,deathly"
fruits basket vol 5 fruits basket 5,16.33,1,5,sequential art,#5,,"fruits,basket,,vol.,(fruits,basket"
foundation foundation publication order 1,32.42,1,5,science fiction,#1,,"foundation,(foundation,(publication,order),#1)"
fool me once,16.96,1,5,default,,,"fool,once"
find her detective dd warren 8,22.37,1,5,add a comment,#8,,"find,her,(detective,d.d.,warren"
evicted poverty and profit in the american city,42.27,1,5,add a comment,,,"evicted:,poverty,and,profit,the"
drama,38.7,2,5,default,,,drama
dracula the undead,35.63,5,5,horror,,,"dracula,the,un-dead"
digital fortress,58.0,5,5,fiction,,,"digital,fortress"
death note vol 5 whiteout death note 5,52.41,1,5,sequential art,#5,,"death,note,,vol.,whiteout,(death"
data a love story how i gamed online dating to meet my match,32.35,3,5,nonfiction,,,"data,,love,story:,how,gamed"
critique of pure reason,20.75,1,5,philosophy,,,"critique,pure,reason"
booked,17.49,5,5,poetry,,,booked
blue lily lily blue the raven cycle 3,34.13,5,5,default,#3,,"blue,lily,,lily,blue,(the"
approval junkie adventures in caring too much,58.81,5,5,autobiography,,,"approval,junkie:,adventures,caring,too"
an abundance of katherines,10.0,5,5,young adult,,,"abundance,katherines"
americas war for the greater middle east a military history,51.22,2,5,history,,,"america's,war,for,the,greater"
alight the generations trilogy 2,58.59,4,5,default,#2,,"alight,(the,generations,trilogy,#2)"
a girls guide to moving on new beginnings 2,31.3,1,5,romance,#2,,"girl's,guide,moving,(new,beginnings"
a game of thrones a song of ice and fire 1,46.42,2,5,add a comment,#1,,"game,thrones,song,ice,and"
a feast for crows a song of ice and fire 4,17.21,4,5,fantasy,#4,,"feast,for,crows,song,ice"
a clash of kings a song of ice and fire 2,10.79,3,5,add a comment,#2,,"clash,kings,song,ice,and"
vogue colors a to z a fashion coloring book,52.35,4,4,default,,,"vogue,colors,fashion,coloring,book"
the shining the shining 1,27.88,3,4,default,#1,,"the,shining,(the,shining,#1)"
the pilgrims progress,50.26,2,4,classics,,,"the,pilgrim's,progress"
the perfect play play by play 1,59.99,3,4,romance,#1,,"the,perfect,play,(play,play"
the passion of dolssa,28.32,5,4,historical fiction,,,"the,passion,dolssa"
the jazz of physics the secret link between music and the structure of the universe,38.71,3,4,nonfiction,,,"the,jazz,physics:,the,secret"
the hunger games the hunger games 1,29.85,5,4,default,#1,,"the,hunger,games,(the,hunger"
the hound of the baskervilles sherlock holmes 5,14.82,2,4,classics,#5,,"the,hound,the,baskervilles,(sherlock"
the gunning of america business and the making of american gun culture,16.81,4,4,nonfiction,,,"the,gunning,america:,business,and"
the geography of bliss one grumps search for the happiest places in the world,28.23,2,4,nonfiction,,,"the,geography,bliss:,one,grump's"
the demonists demonist 1,52.11,2,4,fantasy,#1,,"the,demonists,(demonist,#1)"
the demon prince of momochi house vol 4 the demon prince of momochi house 4,27.88,2,4,sequential art,#4,,"the,demon,prince,momochi,house,"
the bone hunters lexy vaughan steven macaulay 2,59.71,3,4,thriller,#2,,"the,bone,hunters,(lexy,vaughan"
the beast black dagger brotherhood 14,46.08,5,4,fantasy,#14,,"the,beast,(black,dagger,brotherhood"
some women,13.73,5,4,womens fiction,,,"some,women"
shopaholic ties the knot shopaholic 3,48.39,5,4,womens fiction,#3,,"shopaholic,ties,the,knot,(shopaholic"
paper and fire the great library 2,49.45,5,4,fantasy,#2,,"paper,and,fire,(the,great"
outlander outlander 1,19.67,5,4,default,#1,,"outlander,(outlander,#1)"
orchestra of exiles the story of bronislaw huberman the israel philharmonic and the one thousand jews he saved from nazi horrors,12.36,3,4,music,,,"orchestra,exiles:,the,story,bronislaw"
no one here gets out alive,20.02,5,4,music,,,"one,here,gets,out,alive"
night shift night shift 120,12.75,4,4,horror,#1,,"night,shift,(night,shift,#1-20)"
needful things,47.51,4,4,horror,,,"needful,things"
mockingjay the hunger games 3,20.44,4,4,default,#3,,"mockingjay,(the,hunger,games,#3)"
misery,34.79,2,4,horror,,,misery
little women little women 1,28.07,4,4,classics,#1,,"little,women,(little,women,#1)"
it,25.01,3,4,horror,,,
harry potter and the sorcerers stone harry potter 1,13.9,3,4,default,#1,,"harry,potter,and,the,sorcerer's"
harry potter and the prisoner of azkaban harry potter 3,24.17,4,4,young adult,#3,,"harry,potter,and,the,prisoner"
harry potter and the order of the phoenix harry potter 5,31.63,4,4,fantasy,#5,,"harry,potter,and,the,order"
harry potter and the halfblood prince harry potter 6,48.75,5,4,fantasy,#6,,"harry,potter,and,the,half-blood"
harry potter and the chamber of secrets harry potter 2,14.74,1,4,fantasy,#2,,"harry,potter,and,the,chamber"
gone with the wind,32.49,3,4,classics,,,"gone,with,the,wind"
god is not great how religion poisons everything,27.8,1,4,nonfiction,,,"god,not,great:,how,religion"
girl with a pearl earring,26.77,1,4,historical fiction,,,"girl,with,pearl,earring"
fruits basket vol 4 fruits basket 4,50.44,4,4,sequential art,#4,,"fruits,basket,,vol.,(fruits,basket"
far from true promise falls trilogy 2,34.93,2,4,thriller,#2,,"far,from,true,(promise,falls"
dark lover black dagger brotherhood 1,12.87,1,4,romance,#1,,"dark,lover,(black,dagger,brotherhood"
confessions of a shopaholic shopaholic 1,48.94,2,4,default,#1,,"confessions,shopaholic,(shopaholic,#1)"
changing the game play by play 2,13.38,3,4,romance,#2,,"changing,the,game,(play,play"
candide,58.63,3,4,classics,,,candide
can you keep a secret,21.94,1,4,womens fiction,,,"can,you,keep,secret?"
atlas shrugged,26.58,5,4,fiction,,,"atlas,shrugged"
animal farm,57.22,3,4,classics,,,"animal,farm"
a walk to remember,56.43,1,4,romance,,,"walk,remember"
a new earth awakening to your lifes purpose,55.65,5,4,spirituality,,,"new,earth:,awakening,your,life's"
a history of god the 4000year quest of judaism christianity and islam,27.62,1,4,religion,,,"history,god:,the,4,000-year,quest"
salems lot,49.56,4,4,horror,,,"'salem's,lot"
zero history blue ant 3,34.77,1,3,default,#3,,"zero,history,(blue,ant,#3)"
wuthering heights,17.73,3,3,classics,,,"wuthering,heights"
world war z an oral history of the zombie war,21.8,1,3,default,,,"world,war,oral,history,the"
wild from lost to found on the pacific crest trail,46.02,3,3,default,,,"wild:,from,lost,found,the"
whered you go bernadette,18.13,1,3,default,,,"where'd,you,go,,bernadette"
when you are engulfed in flames,30.89,5,3,humor,,,"when,you,are,engulfed,flames"
we the people the modernday figures who have reshaped and affirmed the founding fathers vision of america,31.95,3,3,nonfiction,,,"the,people:,the,modern-day,figures"
we are all completely beside ourselves,24.04,1,3,contemporary,,,"are,all,completely,beside,ourselves"
walk the edge thunder road 2,32.36,3,3,young adult,#2,,"walk,the,edge,(thunder,road"
voyager outlander 3,21.07,5,3,historical fiction,#3,,"voyager,(outlander,#3)"
very good lives the fringe benefits of failure and the importance of imagination,50.66,3,3,nonfiction,,,"very,good,lives:,the,fringe"
vegan vegetarian omnivore dinner for everyone at the table,13.66,2,3,food and drink,,,"vegan,vegetarian,omnivore:,dinner,for"
unstuffed decluttering your home mind and soul,58.09,1,3,nonfiction,,,"unstuffed:,decluttering,your,home,,mind,"
under the banner of heaven a story of violent faith,30.0,1,3,nonfiction,,,"under,the,banner,heaven:,story"
two boys kissing,32.74,2,3,young adult,,,"two,boys,kissing"
twilight twilight 1,41.93,2,3,default,#1,,"twilight,(twilight,#1)"
twenties girl,42.8,2,3,womens fiction,,,"twenties,girl"
trespassing across america one mans epic neverdonebefore and sort of illegal hike across the heartland,53.51,1,3,nonfiction,,,"trespassing,across,america:,one,man's"
threemartini lunch,23.21,3,3,fiction,,,"three-martini,lunch"
thinking fast and slow,21.14,1,3,psychology,,,"thinking,,fast,and,slow"
the wild robot,56.07,3,3,childrens,,,"the,wild,robot"
the wicked the divine vol 3 commercial suicide the wicked the divine,14.41,3,3,sequential art,,,"the,wicked,the,divine,,vol."
the undomestic goddess,45.75,4,3,womens fiction,,,"the,undomestic,goddess"
the travelers,15.77,1,3,thriller,,,"the,travelers"
the tipping point how little things can make a big difference,10.02,2,3,add a comment,,,"the,tipping,point:,how,little"
the thing about jellyfish,48.77,1,3,childrens,,,"the,thing,about,jellyfish"
the stand,57.86,2,3,horror,,,"the,stand"
the smitten kitchen cookbook,23.59,1,3,food and drink,,,"the,smitten,kitchen,cookbook"
the silkworm cormoran strike 2,23.05,5,3,mystery,#2,,"the,silkworm,(cormoran,strike,#2)"
the sandman vol 3 dream country the sandman volumes 3,55.55,5,3,sequential art,#3,,"the,sandman,,vol.,dream,country"
the rose the dagger the wrath and the dawn 2,58.64,4,3,fantasy,#2,,"the,rose,the,dagger,(the"
the road to little dribbling adventures of an american in britain notes from a small island 2,23.21,1,3,travel,#2,,"the,road,little,dribbling:,adventures"
the rise of theodore roosevelt theodore roosevelt 1,42.57,3,3,biography,#1,,"the,rise,theodore,roosevelt,(theodore"
the restaurant at the end of the universe hitchhikers guide to the galaxy 2,10.92,1,3,science fiction,#2,,"the,restaurant,the,end,the"
the rest is noise listening to the twentieth century,34.77,1,3,add a comment,,,"the,rest,noise:,listening,the"
the red tent,35.66,5,3,historical fiction,,,"the,red,tent"
the purpose driven life what on earth am i here for,37.19,3,3,add a comment,,,"the,purpose,driven,life:,what"
the purest hook second circle tattoos 3,12.25,1,3,romance,#3,,"the,purest,hook,(second,circle"
the picture of dorian gray,29.7,2,3,classics,,,"the,picture,dorian,gray"
the paris wife,36.8,3,3,default,,,"the,paris,wife"
the obsession,45.43,1,3,romance,,,"the,obsession"
the nightingale,26.26,4,3,fiction,,,"the,nightingale"
the new guy and other senior year distractions,44.92,3,3,young adult,,,"the,new,guy,(and,other"
the nanny diaries nanny 1,52.53,5,3,womens fiction,#1,,"the,nanny,diaries,(nanny,#1)"
the name of god is mercy,37.25,2,3,nonfiction,,,"the,name,god,mercy"
the maze runner the maze runner 1,20.93,1,3,default,#1,,"the,maze,runner,(the,maze"
the lovers dictionary,58.09,2,3,default,,,"the,lover's,dictionary"
the lonely ones,43.59,5,3,childrens,,,"the,lonely,ones"
the lean startup how todays entrepreneurs use continuous innovation to create radically successful businesses,33.92,3,3,business,,,"the,lean,startup:,how,today's"
the last painting of sara de vos,55.55,2,3,historical fiction,,,"the,last,painting,sara,vos"
the land of 10000 madonnas,29.64,4,3,young adult,,,"the,land,10,000,madonnas"
the infinities,27.41,1,3,fiction,,,"the,infinities"
the husbands secret,52.51,5,3,fiction,,,"the,husband's,secret"
the hitchhikers guide to the galaxy hitchhikers guide to the galaxy 1,47.8,3,3,add a comment,#1,,"the,hitchhiker's,guide,the,galaxy"
the guns of august,14.54,2,3,history,,,"the,guns,august"
the guernsey literary and potato peel pie society,49.53,1,3,historical fiction,,,"the,guernsey,literary,and,potato"
the goldfinch,43.58,3,3,default,,,"the,goldfinch"
the giver the giver quartet 1,12.3,1,3,default,#1,,"the,giver,(the,giver,quartet"
the girl with all the gifts,49.47,3,3,horror,,,"the,girl,with,all,the"
the girl who played with fire millennium trilogy 2,22.14,2,3,default,#2,,"the,girl,who,played,with"
the girl who kicked the hornets nest millennium trilogy 3,57.48,1,3,add a comment,#3,,"the,girl,who,kicked,the"
the exiled,43.45,3,3,mystery,,,"the,exiled"
the end of faith religion terror and the future of reason,22.13,4,3,add a comment,,,"the,end,faith:,religion,,terror,"
the elegant universe superstrings hidden dimensions and the quest for the ultimate theory,13.03,4,3,science,,,"the,elegant,universe:,superstrings,,hidden"
the disappearing spoon and other true tales of madness love and the history of the world from the periodic table of the elements,57.35,5,3,science,,,"the,disappearing,spoon:,and,other"
the devil wears prada the devil wears prada 1,44.29,1,3,womens fiction,#1,,"the,devil,wears,prada,(the"
the demonhaunted world science as a candle in the dark,52.25,4,3,default,,,"the,demon-haunted,world:,science,candle"
the day the crayons came home crayons,26.33,5,3,childrens,,,"the,day,the,crayons,came"
the da vinci code robert langdon 2,22.96,2,3,fiction,#2,,"the,vinci,code,(robert,langdon"
the cuckoos calling cormoran strike 1,19.21,1,3,mystery,#1,,"the,cuckoo's,calling,(cormoran,strike"
the complete stories and poems the works of edgar allan poe cameo edition,26.78,4,3,classics,,,"the,complete,stories,and,poems"
the complete poems,41.32,5,3,add a comment,,,"the,complete,poems"
the catcher in the rye,24.55,1,3,add a comment,,,"the,catcher,the,rye"
the cat in the hat beginner books b1,16.26,2,3,childrens,,,"the,cat,the,hat,(beginner"
the case for christ cases for christianity,47.84,1,3,add a comment,,,"the,case,for,christ,(cases"
the book thief,53.49,2,3,default,,,"the,book,thief"
the book of basketball the nba according to the sports guy,44.84,5,3,sports and games,,,"the,book,basketball:,the,nba"
the blind side evolution of a game,53.71,5,3,add a comment,,,"the,blind,side:,evolution,game"
the autobiography of malcolm x,23.43,2,3,default,,,"the,autobiography,malcolm"
the art of simple food notes lessons and recipes from a delicious revolution,34.32,3,3,food and drink,,,"the,art,simple,food:,notes,"
the art of fielding,22.1,1,3,fiction,,,"the,art,fielding"
surely youre joking mr feynman adventures of a curious character,25.83,2,3,science,,,"surely,you're,joking,,mr.,feynman!:"
stiff the curious lives of human cadavers,36.74,3,3,nonfiction,,,"stiff:,the,curious,lives,human"
spilled milk based on a true story,49.51,1,3,nonfiction,,,"spilled,milk:,based,true,story"
something borrowed darcy rachel 1,48.96,5,3,womens fiction,#1,,"something,borrowed,(darcy,rachel,#1)"
something blue darcy rachel 2,54.62,1,3,womens fiction,#2,,"something,blue,(darcy,rachel,#2)"
soldier talon 3,24.72,2,3,fantasy,#3,,"soldier,(talon,#3)"
shopaholic baby shopaholic 5,46.45,2,3,default,#5,,"shopaholic,baby,(shopaholic,#5)"
seven days in the art world,52.33,2,3,add a comment,,,"seven,days,the,art,world"
seven brief lessons on physics,30.6,4,3,science,,,"seven,brief,lessons,physics"
scarlet the lunar chronicles 2,14.57,4,3,young adult,#2,,"scarlet,(the,lunar,chronicles,#2)"
sarahs key,46.29,1,3,add a comment,,,"sarah's,key"
saga volume 3 saga collected editions 3,21.57,5,3,sequential art,#3,,"saga,,volume,(saga,(collected,editions)"
running with scissors,12.91,4,3,autobiography,,,"running,with,scissors"
rogue lawyer rogue lawyer 1,50.11,3,3,add a comment,#1,,"rogue,lawyer,(rogue,lawyer,#1)"
rise of the rocket girls the women who propelled us from missiles to the moon to mars,41.67,4,3,nonfiction,,,"rise,the,rocket,girls:,the"
rework,44.88,2,3,business,,,rework
reservations for two,11.1,3,3,romance,,,"reservations,for,two"
red the true story of red riding hood,28.54,3,3,childrens,,,"red:,the,true,story,red"
ready player one,19.07,4,3,science fiction,,,"ready,player,one"
quiet the power of introverts in a world that cant stop talking,43.55,1,3,default,,,"quiet:,the,power,introverts,world"
prodigy the graphic novel legend the graphic novel 2,43.63,3,3,sequential art,#2,,"prodigy:,the,graphic,novel,(legend:"
persepolis the story of a childhood persepolis 12,39.13,1,3,sequential art,#1,,"persepolis:,the,story,childhood,(persepolis"
packing for mars the curious science of life in the void,56.68,2,3,default,,,"packing,for,mars:,the,curious"
outliers the story of success,14.16,1,3,nonfiction,,,"outliers:,the,story,success"
original fake,31.45,3,3,sequential art,,,"original,fake"
orange is the new black,24.61,2,3,default,,,"orange,the,new,black"
one for the money stephanie plum 1,32.87,2,3,default,#1,,"one,for,the,money,(stephanie"
notes from a small island notes from a small island 1,40.17,1,3,nonfiction,#1,,"notes,from,small,island,(notes"
night the night trilogy 1,13.51,1,3,nonfiction,#1,,"night,(the,night,trilogy,#1)"
neither here nor there travels in europe,38.95,3,3,travel,,,"neither,here,nor,there:,travels"
naked,31.69,3,3,humor,,,naked
morning star red rising 3,29.4,1,3,default,#3,,"morning,star,(red,rising,#3)"
miracles from heaven a little girl her journey to heaven and her amazing story of healing,57.83,1,3,nonfiction,,,"miracles,from,heaven:,little,girl,"
midnight riot peter grant rivers of london books 1,55.46,2,3,fantasy,#1,,"midnight,riot,(peter,grant/,rivers"
me talk pretty one day,57.6,2,3,autobiography,,,"talk,pretty,one,day"
manuscript found in accra,34.98,2,3,add a comment,,,"manuscript,found,accra"
lust wonder,11.87,2,3,autobiography,,,"lust,wonder"
lila gilead 3,12.47,3,3,fiction,#3,,"lila,(gilead,#3)"
life the universe and everything hitchhikers guide to the galaxy 3,33.26,2,3,science fiction,#3,,"life,,the,universe,and,everything"
life without a recipe,59.04,5,3,autobiography,,,"life,without,recipe"
life after life,26.13,2,3,default,,,"life,after,life"
letter to a christian nation,22.2,1,3,nonfiction,,,"letter,christian,nation"
lets pretend this never happened a mostly true memoir,45.11,1,3,nonfiction,,,"let's,pretend,this,never,happened:"
legend legend 1,43.69,4,3,young adult,#1,,"legend,(legend,#1)"
lean in women work and the will to lead,25.02,1,3,default,,,"lean,in:,women,,work,,and"
lamb the gospel according to biff christs childhood pal,55.5,5,3,humor,,,"lamb:,the,gospel,according,biff,"
lady renegades rebel belle 3,53.04,5,3,young adult,#3,,"lady,renegades,(rebel,belle,#3)"
jurassic park jurassic park 1,44.97,1,3,fiction,#1,,"jurassic,park,(jurassic,park,#1)"
its never too late to begin again discovering creativity and meaning at midlife and beyond,42.38,1,3,nonfiction,,,"it's,never,too,late,begin"
is everyone hanging out without me and other concerns,20.11,3,3,default,,,"everyone,hanging,out,without,me?"
into the wild,56.7,5,3,nonfiction,,,"into,the,wild"
inferno robert langdon 4,41.0,5,3,fiction,#4,,"inferno,(robert,langdon,#4)"
in the garden of beasts love terror and an american family in hitlers berlin,28.85,3,3,nonfiction,,,"the,garden,beasts:,love,,terror,"
if i run if i run 1,49.97,4,3,christian fiction,#1,,"run,(if,run,#1)"
ive got your number,19.69,1,3,womens fiction,,,"i've,got,your,number"
i am malala the girl who stood up for education and was shot by the taliban,28.88,2,3,nonfiction,,,"malala:,the,girl,who,stood"
hungry girl clean hungry easy allnatural recipes for healthy eating in the real world,33.14,3,3,food and drink,,,"hungry,girl,clean,hungry:,easy"
house of lost worlds dinosaurs dynasties and the story of life on earth,43.7,2,3,history,,,"house,lost,worlds:,dinosaurs,,dynasties,"
house of leaves,54.89,1,3,horror,,,"house,leaves"
horrible bear,37.52,2,3,childrens,,,"horrible,bear!"
holidays on ice,51.07,2,3,humor,,,"holidays,ice"
heir to the sky,44.07,4,3,fantasy,,,"heir,the,sky"
green eggs and ham beginner books b16,10.79,4,3,childrens,,,"green,eggs,and,ham,(beginner"
grayson vol 3 nemesis grayson 3,42.72,1,3,sequential art,#3,,"grayson,,vol,nemesis,(grayson,#3)"
gratitude,26.66,5,3,nonfiction,,,gratitude
gone girl,37.6,5,3,default,,,"gone,girl"
golden heart of dread 3,42.21,4,3,young adult,#3,,"golden,(heart,dread,#3)"
girl in the blue coat,46.83,2,3,historical fiction,,,"girl,the,blue,coat"
fruits basket vol 3 fruits basket 3,45.17,2,3,sequential art,#3,,"fruits,basket,,vol.,(fruits,basket"
friday night lights a town a team and a dream,51.22,3,3,sports and games,,,"friday,night,lights:,town,,team,"
fire bound sea havensisters of the heart 5,21.28,4,3,add a comment,#5,,"fire,bound,(sea,haven/sisters,the"
fifty shades freed fifty shades 3,15.36,5,3,adult fiction,#3,,"fifty,shades,freed,(fifty,shades"
fellside,38.62,1,3,default,,,fellside
extreme prey lucas davenport 26,25.4,3,3,mystery,#26,,"extreme,prey,(lucas,davenport,#26)"
eragon the inheritance cycle 1,43.87,3,3,fantasy,#1,,"eragon,(the,inheritance,cycle,#1)"
eclipse twilight 3,18.74,1,3,default,#3,,"eclipse,(twilight,#3)"
dune dune 1,54.86,1,3,science fiction,#1,,"dune,(dune,#1)"
dracula,52.62,3,3,default,,,dracula
do androids dream of electric sheep blade runner 1,51.48,1,3,science fiction,#1,,"androids,dream,electric,sheep?,(blade"
